{
  "$schema": "https://json-schema.org/draft/2020-12/schema",
  "$id": "shed.intent",
  "title": "intent — what a session means to do, declared before it touches files",
  "description": "The one field written BEFORE the work. A session's opening move is one sentence of what it means to do and, when 'done' is honestly a command, that command as a discharge test (`done_when`). Declaring closes pre-planning: it is the exit of the divergent stance, so it is not written while still diverging. PROSPECTIVE, so it carries a lease (lease.json rides flat): `expires` and `scope` are required beside `done_when`.\n\nRead back at handoff as MET (the predicate holds) / UNMET (it fails) / UNARMED (statement only) / ERROR (instrument silent) — surfaced, never enforced; a session that declared nothing is ABSENT, which is 'no probe', not 'no intent'. Re-declaring is allowed and RECORDED: a second declaration with a different statement pushes the old one onto `superseded` with the reason rather than overwriting it, because the drift is the record, not noise. Never rewritten at handoff time to fit the outcome.\n\nWriter today: hololoom_mcp/tools/session_intent.py into the live scratchpad, copied verbatim into the archive. shed's `declare` verb (not yet shipped) writes the same shape; this file is the contract both meet.",
  "type": "object",
  "required": ["statement", "declared_at", "sid8"],
  "allOf": [
    { "$ref": "lease.json" }
  ],
  "properties": {
    "statement": {
      "type": "string",
      "minLength": 1,
      "description": "One sentence — what this session means to do."
    },
    "declared_at": {
      "type": "string",
      "description": "ISO 8601 UTC. When it was declared; must precede the first file edit to count as intent rather than reconstruction."
    },
    "sid8": {
      "type": "string",
      "minLength": 1,
      "maxLength": 8,
      "description": "Who declared it — first 8 of the session id."
    },
    "done_when": { "$ref": "discharge.json" },
    "expires": { "$ref": "lease.json#/properties/expires" },
    "scope": { "$ref": "lease.json#/properties/scope" },
    "superseded": {
      "type": "array",
      "description": "Earlier statements this declaration replaced, oldest first. Kept, never dropped.",
      "items": {
        "type": "object",
        "required": ["statement", "declared_at"],
        "properties": {
          "statement": { "type": "string" },
          "declared_at": { "type": "string" },
          "reason": { "type": "string" }
        },
        "additionalProperties": false
      }
    }
  }
}
